Unnamed: 0,input
0,List: syndrome therefrom
1,List: thrill splutter panicking scorch same dot prod obstetric malton onus drumhead delmarva barn embezzle it&t damp guru subsist entirety greene
2,List: vegetate artillery harm fda doris prosody bainite incongruous monkey vivian
3,List: sioux fortescue purloin percept helmsman
4,List: indifferent trainman bootlegging
5,List: conference apparition ignore dutton layperson coupe superstitious westward turnoff messenger copra floruit primitive implement
6,List: covalent spiderwort horowitz divisive spiritual cheshire affluent gideon quadrature julio peanut epsilon diagnostician grover folklore gothic salient
7,List: euclidean stonehenge hobby cloudy winsome invite thrifty fight majestic citrus surge scene
8,List: thunderclap swab built poland
9,List: regret starlight wallboard cotyledon more pepperoni
10,List: burley bela arapaho bacteria bock
11,List: scrumptious sidereal thermal yakima siena gorky saxon scottish figural hydroxyl seventeen neapolitan rampage nerve grapple fate plainfield stooge knives allotted
12,List: lucrative you've tunnel archery bride coquette polytypy barbudo radix arlen lockwood teem officious
13,List: gentle boletus galveston aniline eddy fontainebleau wile scandalous skat sportsmen
14,List: crowfoot scrupulous campfire contrast purgatory
15,List: bare census intrinsic torch timeout infirm humility snagging exaltation patristic paregoric gnomon moth sorrowful manatee oblique stressful
16,List: marlborough pyrotechnic filly grocer treadle transitive platelet deliver landau hotbox uncle siemens anger hessian gneiss convoy ninebark advent plat stapleton
17,List: filamentous semaphore bulrush audacious xylophone sensate municipal harris intervenor battleground rubicund
18,List: county quantify nail o'connell phony bauer poole venice accelerate nominee raisin putnam
19,List: bituminous ami decadent knickerbocker exeter
20,List: slurp raytheon gloucester
21,List: chlorate glidden incentive manatee spurt lavoisier judicatory
22,List: shouldn't lorenz runneth skintight plastisol swept coven etruscan disturb
23,List: shreveport gamut berg multiplexor bluish puerto subliminal
24,List: daffy hypothesis croupier dockyard household peccary triode minstrelsy nepotism sawtimber mantic info confess serenade summate silver duty loam mandate
25,List: champ jigsaw acclaim pipeline exempt gadwall hypothalamus clothbound sensory lozenge hayes conclusion delirious dyestuff hood seashell commodity plentiful sarcastic teen
26,List: dynastic inflammable prick tristan vitiate tackle stagnate conglomerate nebulae phosphide
27,List: dateline jill langmuir pipette household
28,List: tip abo frond indistinguishable stockholder gasify passenger bonaventure armful oscillatory referential guiana pancreatic through embryology herman dictatorial cremate
29,List: heterostructure bertrand careful wherewith libra eyelid feign southeastern paste snip
30,List: summand cure gloria tyke doubtful extoller entropy crackle procedural cottrell litigant bologna
31,List: inflammation slump schiller jacqueline darkle piano fungi sojourn macaque joanne gobble boldface sst
32,List: thunder phase geld
33,List: convair frighten citizen scrubby birdseed fateful soothe extensive trillion adonis southeastern stormy judaica trundle suppose contaminant
34,List: dulse kowalewski yew politician
35,List: odessa dance formulae dietetic mantle cost huddle resplendent bolshevism proust warmth deadline progeny hesitant palace rackety judson foster belize thirdhand
36,List: mohawk thebes supercilious celandine faith hostile harold diploma octavia
37,List: emission upon labour whim fairfax ride crepe prig accomplice az doff clatter circumcircle tea wheelbase pleura incantation choral viaduct lorry
38,List: kenya beth
39,List: broaden envy
40,List: skinny sharon sudan earthy parentage hello inmate announce co clayton carp phonetic watson nimbus
41,List: blutwurst horizon uranyl arraign portentous faber rancho peste glacier convenient inconspicuous
42,List: yeager bengal fettle
43,List: tuba synapse inaudible brewster tithing
44,List: wintertime mobster ugh brown fleabane longish ipsilateral cortex hair diminutive trapezoidal guy richfield highfalutin borough foot delphinium cosec abstract
45,List: episode molybdenum schedule hen sparkman calabash marietta pedantic pounce vinaigrette berra
46,List: aberdeen swaziland sprightly analogue easel deciduous
47,List: stephen amperage protocol crimea farther raillery tech insolent ping
48,List: keller frame hippodrome bungle yolk anheuser prompt together spidery chaperon miterwort
49,List: benchmark pilot reverie hatchet prorate wince machine loess stallion amphibious percentage redcoat baseplate sank assist wehr homecoming ell thoughtful
50,List: hat core sonnet discreet
51,List: marimba retrofit alphabet birmingham philology fashion educate mechanic cantonese fond entourage
52,List: walnut scoot jugoslavia retrorocket polyhedron
53,List: impede appliance pulitzer superior
54,List: indicate quagmire predacious gut vantage marshal across smuggle flight directrix admixture
55,List: stitch steelmake indomitable wigging cubby sheaf pique thymine exotica good mental brake nick rajah lineage choose bunny drone chevalier
56,List: above prometheus broken coexist big dominate olive screw thirdhand irk
57,List: plebiscite colombo inviolate quagmire garry satanic magnanimity aeneas notoriety nevada foothold glycerine lucre tennyson type scription pompey softball spleenwort fox
58,List: ow cubit upbring gullible awash inane gown bateau scottsdale auxin eutectic jurisprudential pirouette shockley nepenthe pussycat schwartz mistletoe travelogue
59,List: tipoff fructose coleus hurricane cite tularemia irreducible wier improbable whitetail vesper whereabout
60,List: delmarva sawfly aroma nod carcinogen parochial facetious designate syllabus rally
61,List: statutory feed spavin hecatomb pestle plume figural pasty giveth incense undulate middle blackstone tel obstinacy toothpaste hunt sinkhole
62,List: analyses timeshare blueback telephony usa falter credential erda geophysics fireproof den shibboleth swampland keynote porte stonewort testimonial augustine guitar meter
63,List: comet pincer snippet manley injun spokesperson hydrate heusen cocksure
64,List: million boone chalcedony sinai satin genteel alternate charity olden
65,List: voluntary yucca limnology fabulous seventh cube willow kitakyushu sequel senescent bauble length
66,List: whale nevins puree pusey protein pullman benefice squeamish river improvise
67,List: underclassmen pegging dale bartok goat martinson whoop badinage brunswick fraternity allele dar yourselves dun anthropocentric banish starkey morphemic monomer desolater
68,List: sortie neff nicodemus
69,List: berniece bremsstrahlung hoe avalanche showroom goff dactylic befriend hurry housekeep lanka gilbertson posterior flick bong hereafter metazoan
70,List: testy trench sin rheumatic shivery orphanage functor zorn butadiene spec racy heck flair snowball booby
71,List: leatherback scald nikko megohm sojourn woodcarver antaeus hi caw daughter gloria terminal schroedinger magnesium raincoat helvetica devonshire
72,List: sound consternate tariff blest proximity quizzes xerxes buxton
73,List: xylem neoclassic rest fortieth marshall wiley convey experiment whimper kudo decimate incautious z's
74,List: murk pvc singlet yeats muslim coachmen clergymen companion gazpacho embark pristine granular hobble fatten allot too niggle chauncey threefold coddington
75,List: tiresome sweepstake introvert carport firewood
76,List: zinc coriolanus leather easternmost highwaymen scavenge musky cutlet synaptic creak heaven paula astigmat muscular godson boyish
77,List: oblong bucolic whoosh
78,List: dew betelgeuse inexplainable snazzy tao stain meaty blue trail wash grossman lyre caudal epoch trailside char cyanide
79,List: opinionate interior ebb seeable jurassic flatland mammary cardamom forthwith licensor landslide valkyrie cryptic bully insurmountable nassau
80,List: neal orthodontist soybean expatriate elliot unipolar ann cometh blake confirmatory casual crinkle carbondale hangable degum bishopric shenandoah telegraph allocate tuxedo
81,List: matte game aldebaran inkling fiberboard pulsate lakeside shape mcgee watchworks entrepreneurial boxwood peruse backyard cabbage polyhedra lightface rowley rae invincible
82,List: ecosystem cloudy ferret knotty
83,List: definite translate aggression arachne lengthy sanford bystander asplenium gneiss southeast
84,List: chassis caruso corporal signora
85,List: nv menlo boyd counterweight groove spumoni intangible sans ovipositor hide detergent besetting
86,List: betony bronzy charge cordial handicraft boar collet clemens bootleg possession mesh centaur contemporaneous macmahon underclassman monterey dorado contravariant regina
87,List: admixture catwalk shelve panamanian reluctant higgins suction irremediable chateaux offertory malthusian coordinate tunis pecos equine
88,List: wreak hidebound bandwidth
89,List: arroyo ambient voltmeter secretary appropriable intimidate breccia o'connor surtout perplex coupon martinson terrestrial faze eardrum fivefold billion social
90,List: frontage gunky indeterminable smokestack taint assure ostentatious sanderson contend paradigmatic lustrous butterball deaf dinosaur bully rhyme sashimi bye cornet
91,List: lung secretive cotman coffman quirinal detour rhubarb notate monologist jacobean gnostic stove collision membrane hammock tobacco backpack
92,List: coypu anharmonic inflammation beauteous
93,List: consignee can't artistry golf cascade markov nine swingable shanghai condiment projectile mimosa glance gentlemen wildflower tale
94,List: quench autocracy lodge exploitation custody ventricle annuity bruno thunderclap militant somatic dare acquisitive
95,List: gazpacho indiscreet ballast erosible agglomerate ogle dollop spaniard oilcloth expiry manuel extensor
96,List: falter tuscarora invigorate porridge wetland libya residuary wrapup ludlow landlady kamikaze christiana jot antler mallow
97,List: crystallography survey bindle rundown shipshape roadside strange chiang dent mambo savannah spew won't ram
98,List: deform budd
99,List: lise snipe miaow
100,List: foliate damon europa potpourri
101,List: torpedo phosphorescent pristine decadent shrunk dey administer gradate littleneck thrown jacky coachman aeneid verdict tasting sinh delhi systemwide grim
102,List: spontaneity smooth execrable epaulet bobbin calumny hun anastasia omnipotent award hostelry macedon roughshod burrow align apache putty adsorption anastomotic
103,List: deadwood macedonia foxtail block hexadecimal guaranty rubaiyat victoria custodian
104,List: din spruce nate pomade jordan gaillardia putt inroad jest kill jackboot whelan mirth amerada craftsmen shortcoming eclipse
105,List: roadster earl metaphoric hollandaise supranational psyche pedro gloss granola quarantine inauspicious penis baccarat arenaceous mackenzie blare bowman
106,List: solstice roadway loquacious niece planet steed abutted hondo loosen agamemnon islamic capacity tibet hitachi essex casualty guinea aquatic suspicion
107,List: twelvefold o'connell mainstream malformed umbilical bivalve vinegar mortify sleuth paunchy
108,List: boletus ulysses debugging passband lucretia necktie deportee calypso revving conklin omnipotent
109,List: closeup thesaurus intelligent buckaroo vertebral wily blutwurst laguerre
110,List: faithful broom integer menu gondola deathward brainwash soc kinematic
111,List: wv habitation panicking schoolmate aerodynamic giacomo nebulous offset vector roosevelt jimmy botanist suburbia padre
112,List: labile crunchy highlight silage judaism allocable vale phenol dissipate bertram necessity champlain boutique hydrology facto often
113,List: hodges deoxyribose troupe motorcade devisee stratify auerbach decor incommensurable dianne
114,List: bijective song guidebook briton irrevocable eigenspace reversible floruit dive jacket dim glycogen pinkish gaucherie concord
115,List: fallen juvenile bermuda diagram ezra screechy aristocratic musty absorption slack quartile nod nigeria testicle congo cheerful eucre cesium
116,List: stanhope sisyphus fungi purpose midwinter mendelevium studious driveway symmetry despond trample wring strip clearheaded encapsulate vs gob christen
117,List: marshmallow doge alpenstock ocean accept angus drool jutish resistive chromium vociferous castigate prize octennial stonewort concision elizabethan
118,List: jocund flagellate bodyguard flotation commensal involve miff ineradicable postprocess
119,List: gloriana milord rendezvous schnabel allegoric loge lollipop salle collate prolix mast euphony
120,List: pea yonkers darkle quadrant moldboard instant olsen hookup erudite lip
121,List: regret uptake satisfy behold fumarole motif forth alcohol escutcheon pease hackberry walkie
122,List: charcuterie muddle diatom impenetrable footfall crucifix greenberg synchronous spoken
123,List: sibyl calligraph goat inverness form threadbare
124,List: cashew apprehension ensemble
125,List: seashore haughty
126,List: postcondition protoplasmic musicology helical uptrend vasoconstriction diacritic beefsteak beware birthplace bicycle junctor state obstinate banshee sap
127,List: whisper eyesight titmice mirage fletch cry biennial creedal miltonic fraudulent j
128,List: multitudinous adopt wage worcestershire pacifist afghan glimmer friday
129,List: lethe bilk perturb tactual
130,List: liggett sterno pintail dilate frolic piggish forth parameter slaughterhouse lacunae mcintosh bloodstain lazy unesco protector beachhead algonquin
131,List: erudite marriageable stahl coach inadvisable vicksburg virgo brownian eosine magnesium flax
132,List: clifford brindle siskin gloat florist triploidy willard sacramento
133,List: confrontation quantitative proserpine proofread daddy hirsute
134,List: allyn carbonaceous majorca investigatory supersede cetacean pathogenic johann tung paradigmatic pray
135,List: calyx emphases vii elgin perquisite implacable blackbird afro jura mayapple whit blame
136,List: cast palazzi inhibit arragon tabletop danbury abbe adposition emplace gavin income falsetto onerous
137,List: ulcerate ballroom sparse intrepid arcing prorogue dodge benefit coupon ladle buggy shagging bassoon hypothermia decide affirmative airframe junior nineveh schmitt
138,List: statuette whiteface lauderdale encumber atonic specify olivia adipic neutrino antique catch persona athlete sovereignty
139,List: hyperboloidal borough
140,List: yves butt scribe seaworthy manumitted clapeyron lift blackguard reconnaissance agile woodcut lightfooted sawbelly meager geophysical wiseacre mathieu cognoscenti purposive flamboyant
141,List: duane harriet impressible whippet glamour cowbell vietnamese fest switchboard anaglyph texture
142,List: plural dose allstate stalin dyad multitudinous powderpuff
143,List: crossbill bushland capacitive meager ricochet battery enigma wysiwyg wallet lipton jane wacke contingent
144,List: corpulent diagnose code scalp bombproof fluorine blythe swipe honeybee damn pore maharaja cytolysis solicit
145,List: fugue chicanery mountain
146,List: sideboard procrustean seepage buxton olympic tty typescript marque callus unitary cameron contribute precise verify shelf extensible methanol
147,List: sociolinguistic nigeria odysseus demystify proton voltaire penny contaminate bighorn stirrup
148,List: greasy lapidary mark
149,List: choreograph retardant multifarious pro carbonic equestrian wishful wigwam countersink libya authenticate metal have corvallis nitric petition obfuscatory
150,List: oakland seaborg jacobi membrane trapezoidal allis marmot toggle anthology
151,List: monotonous slick provocation functor hideaway holeable assimilable lola calypso nebuchadnezzar dogwood pacifism bivariate bought
152,List: livre substitution ix frisian panoramic buckley
153,List: no spokane cartilaginous that'd science
154,List: splashy rectitude novelty
155,List: sediment varsity towel fracture
156,List: confidential ursa fiction heterozygous faery overture horehound
157,List: mckinley pesticide school radiometer marque prig relish trianon inspiration artful cancelled castrate glaucous ear croon tioga rothschild excite endpoint citadel
158,List: iniquity yoghurt behind volcanism hornpipe mcconnell scorn zip toroidal mollie sandy wellwisher inmate
159,List: extempore gotten
160,List: yang relinquish merry maladjust olefin canaan ranch batavia
161,List: yuh edt cheddar oblivion from poignant pang
162,List: zan natalie coplanar stevenson
163,List: bottle kenney chapati okinawa boon bedtime
164,List: contrariety hoop muong dimorphic crochet forthwith hurty titrate prodigy polytope guaranteeing atavism emanate iniquity grind more katie
165,List: sloane molten equip hillman max cochran practise advisee kuwait chancery hoofprint cardigan evildoer retinue wuhan ape apostate acrobacy crowbait
166,List: catawba almagest transfusable milt photolysis limpid gnome archenemy sagging councilwomen decrement jungian
167,List: inscribe upraise perceptive tragedian peculate cunard posterior crude danubian
168,List: madeira offprint trafficked immemorial subject micro clinic sprue marx va anaheim eaten
169,List: reedy bully multiple edt sell referring lexicographer tit flogging perceptive minor bosporus rancorous forfeit pizza pungent sedition cork
170,List: thirteenth tinfoil thimble snuff ernie pow celebrity abuilding indiscoverable chigger burgher synchronous yap medlar exorcism newsboy
171,List: saprophytic confident pam stowaway stupor foundling compton
172,List: epiphyte swift sail anchor barre dimension faunal integrate eleanor edgy singular patrician orthodoxy parasol pendant buckle concatenate masochist
173,List: butterscotch veterinarian kochab molybdate extoller amos farrell academia glance predatory beautiful ford fiducial metzler europium circuitous diatom monomer
174,List: mater rica sigmund dean eosine inebriate gibson vassar mulligatawny formula
175,List: shakespearian laudatory
176,List: fasciculate judicature presto
177,List: thereupon wireman crag scrawny electrolytic wife cutover dickson clytemnestra took diocletian lipton inhuman stalk workplace marginal
178,List: bruckner admiration technion bandgap heron postprocessor maidenhair fungus allusion gambit accessory proscenium cruise
179,List: grammarian chivalry polkadot gastronomic ferocity brenda knutson endothelial phenotype irreducible bilinear rockaway derivate eaten cacao scurrilous
180,List: hyperboloid buckle liquidate alkali nagasaki breach falsetto parmesan mirth
181,List: hornblower dissipate amanita canticle annoy besiege straight notre propylene sepia california pasture encephalitis boggle crocodilian dexter snipe amatory dizzy psychiatric
182,List: peaceable residue sulfanilamide kingsley eft caliber headboard stamp phillip upholster irishman lobby nary gastrointestinal fragile faulkner capricious ouzo phylum
183,List: multiplet catsup hypothalamus scherzo bridesmaid average therewith invocable coddle charm inequity region abbas trumpery memorandum shutout integral dogfish phloem inconvertible
184,List: windowsill appoint biharmonic moustache baneberry wiry dyne pirate
185,List: zoroaster skimpy
186,List: almost delphic semitic unbeknownst astute deadlock libertarian antic levitate execution sanction scathe storehouse dandelion affable sweeney fortunate leverage horntail apache
187,List: percent maser roadside we're caching distort phillip emboss epistemology gherkin somewhat spicy injustice winston savoyard delicious defend indicate
188,List: anarchic liven shortcut total diatom guelph usage acoustic yarmulke phenomenology neo bureaucracy trammel leftward immovable fabricate syndrome suggestive provide
189,List: them abdominal address fomalhaut pay optimal hanoverian yang berry tattoo islamabad swathe jordan bounty stearic stigmata involve effusive tornado
190,List: maraud downtrodden hurst propane morphine parsonage gadgetry inertial gamin
191,List: foamflower lawful cayenne chandigarh only excursion declassify equanimity aseptic inclement october debauch kruger groupoid scorch dingy alterate
192,List: acidify antagonism asteria
193,List: elton olympic iodinate captious ineligible sherman
194,List: alleviate duopoly mattress gland benelux townsmen buoyant klaxon hardbound tomography felice gunk
195,List: solvate nat usable kajar downey vision detest aitken barycentric
196,List: griffith common nanosecond loosestrife decoy swabby aerospace denmark yates frill spitz enviable screechy allure sow spermatozoa saute jibe exclusive
197,List: reverie giantess muddy mast callous bate dnieper prank cortez staunch satisfy dogging moran climb garrison
198,List: avoid whimsey grassland elegy pitfall error gaillardia hostile caramel conclave stepchild accept carbuncle compressor utopia drib spectra rosa embower
199,List: rowley midshipman saline furl geld locomote exhumation anarchic bstj gradual riddance j liniment pantheist elution profess
200,List: hangout drafty supposable sushi proscenium anticonvulsant you'd magnificent scrub embolden hasty pewee carrageen disseminate glamour discovery registrar acuity
201,List: sweatband murray
202,List: resignation dormouse bathos walt amethyst obtuse
203,List: paginate amicable they've histology extreme indoeuropean sonority tramway turvy coo deerstalker browne henchman pelvis calumny
204,List: transgressor sidewinder tacky casualty shouldn't courtier leprosy avoidance gibbon merge
205,List: intercept tamp geopolitic loci newsmen umber credit atmospheric lunge siren swart chess
206,List: wink envious scotia planetaria pooh emancipate army
207,List: condescend rampant percolate coltish date rochester placid significant
208,List: infantrymen knob yaounde aqueous deregulate lysergic gala
209,List: promulgate altercate foraminifera sophocles raft wrongdoer syllabus jive cornerstone gossamer courtroom insist dusenberg sal
210,List: jacob sleight globule consonant musician
211,List: nascent muddy
212,List: automate abner shampoo gurgle none exquisite abramson amity fruitful shorten waterproof
213,List: search marcello depreciate unary frame numbly sprout clench agamemnon herbivorous eject zaire lien forum
214,List: saul fresco teen chopstick footwork smalley anaplasmosis palisade orthography storey bumble pilate clue ingot fiesta
215,List: avalanche chaplin squabble coachman ipsilateral clonic cameroon fortran cram medea referring kennan canal pyridine ussr postpone
216,List: peculiar margaret contravention ingratiate dreg superintendent drapery bizarre sequential
217,List: sweatshirt bone ia wagoneer doleful homeobox hindustan convergent
218,List: pewter gross gujarati cortland diffusible nomograph stag broadcast galvanometer transition incestuous sketchbook scout larynx
219,List: portsmouth impalpable portrait gouda brainy succumb fatuous hoof lisbon erudite malaria enigma isaacson cony stronghold servomechanism
220,List: testate orchestra permafrost leasehold shiva
221,List: logarithm robertson inanimate uganda micron incurring wilcox lumber sammy souvenir newman profuse maladapt cone butch airlift homeowner
222,List: chrysalis wallaby
223,List: dredge checksum huckster baronial spotlight circumstance eulogy comment felicia dartmouth monochromator neuroanatomic emittance
224,List: breezy germinal biplane canada nutrient archipelago peloponnese thigh conspiracy constructor accrue dobbin lost hamburger insubstantial malleable ted laramie
225,List: wagging cabdriver astronomic pivot loch coherent
226,List: inability nucleus vague possible invocable janice erg
227,List: gag grecian ada nobody militia wildcat right abc blend cankerworm hanukkah pierson ron falcon quad flamboyant lobster kruger austere indicate
228,List: babysat curvaceous hugh cutaneous spoke consul stationarity regiment
229,List: woebegone nimble complementary afternoon immaculate laughlin kind hesitate loire septuagenarian sandia toggle dixie horsepower sierra shuffleboard mechanism
230,List: linchpin arrear eavesdropping fasciculate shin postdoctoral maritime ibn henry hermaphrodite sticky jane brookside incorrigible vehicular herodotus
231,List: sinter cortex kangaroo pillage threshold insane mcleod roundabout stipulate marionette trammel incident
232,List: soulful dnieper labile lease vehicular
233,List: cornerstone green brindle prowl nonce ballard scrappy credulous des pitney difluoride toward predilect nostalgic rape mixup horseplay jew curio
234,List: covenant thence davenport sonorant scoreboard densitometer noisy
235,List: inhabitation bona cicero purport gaussian silver responsible rastus zig exonerate portfolio coastal asset ruanda dusky handlebar
236,List: implementor bangui nudge cavalier refractory islamabad contextual abramson waite railway carlisle magistrate silvery picnicking dustbin emacs
237,List: strove hendrickson apostasy jacm indonesia vibrate afloat lanthanide grosbeak scavenge quark chattel conner bechtel melancholy ferment
238,List: spongy separate gabriel jackson quail hendrickson washy backslide shelter calvert anastomosis variety commando pizzicato sticktight syndicate hollister
239,List: behold oxalic maybe hew steel termcap pray stiffen dissipate misogyny format dew
240,List: dove rodriguez sonant monaco strap horticulture claret play paschal bizarre valuate colonist baden deplore
241,List: patrolman arabesque novel spearmint arkansan bend brassiere diagnosable ytterbium sheep bedroom yen planeload deterrent fossiliferous alveolar trident fluke curvilinear
242,List: papaw perfidious frugal labial feel sonar blunderbuss box dinnertime oresteia
243,List: haddock colossus sheepskin honeymoon candid pragmatic agrarian people applicate
244,List: catechism daddy
245,List: holocene muriel r&d pathetic talon mare staircase bradshaw aperture sigh
